{
  "schema_version": 1,
  "id": "b98205958ba198f1fac71a722e18b2fe5d70975f77b87059290c94e37c5bdc18",
  "status": "saved",
  "title": "Post earnings, we met several large institutional investors in New York and Boston post earnings, with the roadshow o…",
  "url": "https://x.com/_balaji_km/status/2086812466701566374",
  "source": "X Bookmarks",
  "category": "Bookmarks",
  "date": "2026-08-10T13:50:37.000Z",
  "saved_at": "2026-08-13T00:13:08.808Z",
  "themes": [],
  "tickers": [],
  "type": "bookmark",
  "snippet": "Post earnings, we met several large institutional investors in New York and Boston post earnings, with the roadshow organized by Jefferies. Today, Jefferies has raised its recommendation on Uber to…",
  "folders": [
    "Pitches"
  ],
  "tags": [],
  "highlights": [],
  "content_html": "",
  "content_kind": "tweet",
  "content_text": "Post earnings, we met several large institutional investors in New York and Boston post earnings, with the roadshow organized by Jefferies. Today, Jefferies has raised its recommendation on Uber to a \"Franchise Pick\" as they believe the setup is increasingly bullish.",
  "content_meta": {
    "platform": "x",
    "tweet_id": "2086812466701566374",
    "thread_length": 1,
    "is_note_tweet": false,
    "enriched_at": "2026-08-13T00:13:08.807Z"
  }
}
