{
  "schema_version": 1,
  "id": "84b48c8e5b4fde813c7fb77180ecd61e1866c355ac7f729434c857c599cc1d99",
  "status": "saved",
  "title": "Removing Friction",
  "url": "https://writing.local/ff4b5c328d7746c19ddad2eb51061191",
  "source": "Writing",
  "category": "Writing",
  "date": "2026-08-06T23:03:44.553Z",
  "saved_at": "2026-08-06T23:11:37.336Z",
  "themes": [],
  "tickers": [],
  "type": "article",
  "snippet": "I wanna do X. I am in Y. What are the things that do not matter and that make this transition harder? That is friction. Want to learn about x? Have to spend time going across tabs, twitter, spotify…",
  "folders": [
    "Non-market"
  ],
  "tags": [],
  "highlights": [],
  "content_html": "I wanna do X. I am in Y. What are the things that <b>do not matter </b>and that make this transition harder?<br /><p></p>That is friction. <ul><li>Want to learn about x? Have to spend time going across tabs, twitter, spotify, etc. Friction.</li><li>Want to recruit for IB? Have to spend time keeping track of emails, answers, etc. Friction.</li></ul>Removing friction is important because of two main factors. Firstly, it takes time. No one wants do spend time on shit that no one gives a fuck. Secondly, and I think the most important one: it reduces the enthusiasm and willingness to do what really matters. Living 2min from the gym? Amazing. No lazy excuses. Have to take 3 buses, 2 trains, and walk 3 miles. No fucking way. What are the \"frictions\" of my life? Can AI solve any of them?<ul><li>Learning -&gt; Solved</li><li>Recruiting and keeping track of all the BS -&gt; In process</li><li>What else there is? Beyond removing shit that does not matter, how can it empower the ones that do?</li></ul>"
}
