{
  "schema_version": 1,
  "id": "e4df3fac7b21c1449442501f8197aa5edfa43b5df78e0faeb9e77a6c069272ea",
  "status": "saved",
  "title": "Verde Ações Brasil — Jun 2026",
  "url": "https://www.verdeasset.com.br/public/files/rel_gestao/118/Acoes-REL-2026_06.pdf",
  "source": "Verde Ações Brasil",
  "category": "Letters",
  "date": "2026-06-01",
  "saved_at": "2026-08-22T05:39:36.628Z",
  "themes": [],
  "tickers": [],
  "type": "article",
  "snippet": "Relatório de gestão",
  "folders": [
    "13k"
  ],
  "tags": [],
  "highlights": [],
  "content_html": ""
}
