{
  "schema_version": 1,
  "id": "098fabebade7331375085963b19f2cb0d5053003de81da4c9f8454a129cb47e6",
  "status": "saved",
  "title": "https://t.co/4nJAjpQLUi",
  "url": "https://x.com/gregoryblotnick/status/2047854756870127649",
  "source": "X Bookmarks",
  "category": "Bookmarks",
  "date": "2026-04-25T01:46:35.000Z",
  "saved_at": "2026-08-06T02:59:36.640Z",
  "themes": [
    "future"
  ],
  "tickers": [],
  "type": "bookmark",
  "snippet": "https://t.co/4nJAjpQLUi",
  "folders": [
    "Non-market"
  ],
  "tags": [
    "future"
  ],
  "highlights": [],
  "content_html": "",
  "content_kind": "article",
  "content_text": "https://t.co/4nJAjpQLUi",
  "content_meta": {
    "platform": "x",
    "tweet_id": "2047854756870127649",
    "thread_length": 1,
    "is_note_tweet": false,
    "enriched_at": "2026-08-06T02:59:36.640Z"
  }
}
