{
  "schema_version": 1,
  "id": "a8c430c5a47d5fb1f098345e63fdd0ccd2b9bb67fc303f2fa0852bb789f4bc37",
  "status": "saved",
  "title": "I'm a former Citadel quant who covered power &amp; gas. There's constant talk about chips &amp; memory, but power is…",
  "url": "https://x.com/neelsomani/status/2084719248048529848",
  "source": "X Bookmarks",
  "category": "Bookmarks",
  "date": "2026-08-04T19:12:55.000Z",
  "saved_at": "2026-08-06T02:59:25.923Z",
  "themes": [
    "future"
  ],
  "tickers": [],
  "type": "bookmark",
  "snippet": "I'm a former Citadel quant who covered power &amp; gas. There's constant talk about chips &amp; memory, but power is the central bottleneck for AI. Very few people understand it, so I'm posting a…",
  "folders": [
    "Markets"
  ],
  "tags": [
    "future"
  ],
  "highlights": [],
  "content_html": "",
  "content_kind": "thread",
  "content_text": "[1/2 @neelsomani] I'm a former Citadel quant who covered power & gas. There's constant talk about chips & memory, but power is the central bottleneck for AI. Very few people understand it, so I'm posting a canonical primer on power pricing & data centers: https://power2026.ai/ --- [2/2 @neelsomani] Thanks @samuel_spitz and @fkpxls for editing. Happy to answer any questions people have about power. The primer hit #1 on Apple Books (across all free books): https://books.apple.com/us/book/power-2026/id6795926467",
  "content_meta": {
    "platform": "x",
    "tweet_id": "2084719248048529848",
    "thread_length": 2,
    "is_note_tweet": false,
    "enriched_at": "2026-08-06T02:59:25.923Z"
  }
}
