{
  "schema_version": 1,
  "id": "78c4225478c6c0cea194244ae662bc96480545b606de02f8f300c8c52b299d44",
  "status": "saved",
  "title": "https://t.co/F91zuKaEXy",
  "url": "https://x.com/gregoryblotnick/status/2065478116617957593",
  "source": "X Bookmarks",
  "category": "Bookmarks",
  "date": "2026-06-12T16:55:32.000Z",
  "saved_at": "2026-08-06T02:59:32.397Z",
  "themes": [],
  "tickers": [],
  "type": "bookmark",
  "snippet": "https://t.co/F91zuKaEXy",
  "folders": [
    "LS"
  ],
  "tags": [],
  "highlights": [],
  "content_html": "",
  "content_kind": "article",
  "content_text": "https://t.co/F91zuKaEXy",
  "content_meta": {
    "platform": "x",
    "tweet_id": "2065478116617957593",
    "thread_length": 1,
    "is_note_tweet": false,
    "enriched_at": "2026-08-06T02:59:32.397Z"
  }
}
