{
  "schema_version": 1,
  "id": "35b8d886053236cd15ff0d40961696511447bcfe7f6fd8b71dbe951cd0d09d4c",
  "status": "saved",
  "title": "How to be a better person",
  "url": "https://writing.local/048d4484336d4ba9b5174fd70b3178df",
  "source": "Writing",
  "category": "Writing",
  "date": "2026-08-20T01:50:03.999Z",
  "saved_at": "2026-08-20T02:14:22.553Z",
  "themes": [],
  "tickers": [],
  "type": "article",
  "snippet": "Want to get healthier. Eat protein and vegetablesWant to get stronger. Go to the gymWant to get more intelligent. Read booksThere are a lot of mainstream and common knowledge shit about being a \"be…",
  "folders": [
    "Non-market"
  ],
  "tags": [],
  "highlights": [],
  "content_html": "Want to get healthier. Eat protein and vegetablesWant to get stronger. Go to the gymWant to get more intelligent. Read booksThere are a lot of mainstream and common knowledge shit about being a \"better\" person. Yes, stronger, healthier and more intelligent are better. However, religion, meditation, journaling and all those other things are not treated in the same way as the three examples in the top. They are all, without a doubt, mechanisms and protocols humans (or God) create that should have an effect to become a better person.<h2>What do they have in common?</h2><b>Fuel: </b>Why? What is yout fucking motivation?<b>Specification? </b>What are you doing that it will make you a better person? What exactly types of outputs are you searching<b>Repetition</b><b>? </b>Going to masses? what is the repetitive behavior you are having that will make you a better person?<b>Field? </b>What is the place, both physical and non-physical that you implement this.<b>Detection? </b>How am I going to percieve that I am getting closer or not to the target?I've always felt that I hand a really easy job in incorporating behaviors and attitudes I read. I can see how a lot of buffet/munger ideas I read when I was younger, or how Dostoevsky saying \"never lie to yourself\" have changed my approach and inner working. I was/am always fast in incorporating feedback. This yielded me the question: how can I implement this in a better way. What type of mechanisms can I create in my life to do so. What can my moral gym be?<h2>Mechanism proposition</h2>0. Motivation (I want to be a better person).1. Define a specification (what is the type of behavior/reaction I am trying to acquire). Keep with it for 90 days.2. Go to the Church (Duke Chapel is what I mean here)3. Enter in your app. Go to the \"xx/xx/20xx\" section. Do the 10 times breath exercise Rod showed to get \"in the present\". Go over your past day, looking at how many times you did not achieved the virtue. And how many you did. Read the short-term piece about someone implementing the virtue. It can be Jesus, Buddha, Munger or anyone else you deeply respect. Imagine/mentalize what could be the different behavior in your bad situations. Pray 1/5 of the Holy Rosary. 10 times breath exercise. Leave.4. During the day, write every time you weren't complacent with the virtue. Let's see.<br />"
}
