{
  "schema_version": 1,
  "id": "40c91de1371fcbbf648b46a70969129b3f97cdb5be6e532bc8f3888e9e09b0b4",
  "status": "saved",
  "title": "\"Humans compete for status everywhere...offices, universities, sports leagues, restaurants, clubs, politics, business…",
  "url": "https://x.com/robkhenderson/status/2096795417656635759",
  "source": "X Bookmarks",
  "category": "Bookmarks",
  "date": "2026-09-07T02:59:18.000Z",
  "saved_at": "2026-09-11T07:55:20.186Z",
  "themes": [],
  "tickers": [],
  "type": "bookmark",
  "snippet": "\"Humans compete for status everywhere...offices, universities, sports leagues, restaurants, clubs, politics, business, art, and just about any other social endeavor you can think of. Sometimes peop…",
  "folders": [
    "Non-market"
  ],
  "tags": [],
  "highlights": [],
  "content_html": "",
  "content_kind": "tweet",
  "content_text": "\"Humans compete for status everywhere...offices, universities, sports leagues, restaurants, clubs, politics, business, art, and just about any other social endeavor you can think of. Sometimes people do it openly. Sometimes they pretend not to.\" https://www.robkhenderson.com/p/some-status-games-are-worth-playing",
  "content_meta": {
    "platform": "x",
    "tweet_id": "2096795417656635759",
    "thread_length": 1,
    "is_note_tweet": false,
    "enriched_at": "2026-09-11T07:55:20.185Z"
  }
}
