{
  "schema_version": 1,
  "id": "2511c55d99c04f601bc84fa683e18ffc708b33be13cd58273f41e0f4f8eafc71",
  "status": "saved",
  "title": "If you’re a young investor trying to make sense of this market, you have to bookmark this and read it line by line. J…",
  "url": "https://x.com/RealNickMugalli/status/2091528072239472910",
  "source": "X Bookmarks",
  "category": "Bookmarks",
  "date": "2026-08-23T14:08:45.000Z",
  "saved_at": "2026-09-08T01:55:38.309Z",
  "themes": [],
  "tickers": [],
  "type": "bookmark",
  "snippet": "If you’re a young investor trying to make sense of this market, you have to bookmark this and read it line by line. Josh Kushner (whose a legend imo) wrote his first ever formal letter to backers o…",
  "folders": [
    "Markets"
  ],
  "tags": [],
  "highlights": [],
  "content_html": "",
  "content_kind": "note",
  "content_text": "If you’re a young investor trying to make sense of this market, you have to bookmark this and read it line by line. Josh Kushner (whose a legend imo) wrote his first ever formal letter to backers of his $65 billion firm, Thrive Capital. it offers a rare window into where the smartest capital is actually flowing. Winning isn't about diversification anymore…",
  "content_meta": {
    "platform": "x",
    "tweet_id": "2091528072239472910",
    "thread_length": 1,
    "is_note_tweet": true,
    "enriched_at": "2026-09-08T01:55:38.309Z"
  }
}
