{
  "schema_version": 1,
  "id": "861cafc701ae6cf95feefbcca9e3ded7d05fa80231512097f6f471066813ffed",
  "status": "saved",
  "title": "https://t.co/zP76YN0JTA",
  "url": "https://x.com/gregoryblotnick/status/1995504134372380789",
  "source": "X Bookmarks",
  "category": "Bookmarks",
  "date": "2025-12-01T14:43:54.000Z",
  "saved_at": "2026-07-06T17:19:45.746Z",
  "themes": [],
  "tickers": [],
  "type": "bookmark",
  "snippet": "https://t.co/zP76YN0JTA",
  "folders": [
    "LS"
  ],
  "tags": [],
  "highlights": [],
  "content_html": "",
  "content_kind": "article",
  "content_text": "https://t.co/zP76YN0JTA",
  "content_meta": {
    "platform": "x",
    "tweet_id": "1995504134372380789",
    "thread_length": 1,
    "is_note_tweet": false,
    "enriched_at": "2026-07-06T17:19:45.746Z"
  }
}
