{
  "schema_version": 1,
  "id": "9a43fdeaa6f88f8c762c0984fa52c87f9d7c5bd9cfe9fe8befb2fcd48975a91e",
  "status": "saved",
  "title": "https://t.co/ayMMLUXJBS",
  "url": "https://x.com/gregoryblotnick/status/2031715799551909965",
  "source": "X Bookmarks",
  "category": "Bookmarks",
  "date": "2026-03-11T12:56:08.000Z",
  "saved_at": "2026-07-26T15:50:36.947Z",
  "themes": [
    "on-going"
  ],
  "tickers": [],
  "type": "bookmark",
  "snippet": "https://t.co/ayMMLUXJBS",
  "folders": [
    "LS"
  ],
  "tags": [
    "on-going"
  ],
  "highlights": [],
  "content_html": "",
  "content_kind": "article",
  "content_text": "https://t.co/ayMMLUXJBS",
  "content_meta": {
    "platform": "x",
    "tweet_id": "2031715799551909965",
    "thread_length": 1,
    "is_note_tweet": false,
    "enriched_at": "2026-07-26T15:50:36.946Z"
  }
}
