{
  "schema_version": 1,
  "id": "3de4717650509e23b43ec7847813e08cce5de89b7c89cfbc98672f3de610e716",
  "status": "saved",
  "title": "Everything is a DCF - Maubossin",
  "url": "https://www.morganstanley.com/im/en-us/individual-investor/insights/consilient-observer/everything-is-a-dcf-model.html",
  "source": "Morganstanley",
  "category": "Bookmarks",
  "date": "2026-07-06T16:54:28.491Z",
  "saved_at": "2026-07-26T19:44:57.330Z",
  "themes": [],
  "tickers": [],
  "type": "bookmark",
  "snippet": "",
  "folders": [
    "LS"
  ],
  "tags": [],
  "highlights": [],
  "content_html": ""
}
