{
  "schema_version": 1,
  "id": "8b660cc9ef6594fbf3eff5a1cf91feb5771f7f3657e97dd40ed81b5b520bb0c7",
  "status": "saved",
  "title": "PERF — PERFECT CORP (Long)",
  "url": "https://valueinvestorsclub.com/idea/PERFECT_CORP/1667537748",
  "source": "Value Investors Club",
  "category": "Investing",
  "date": "2026-05-22 11:45:30",
  "saved_at": "2026-07-06T20:59:43.858Z",
  "themes": [],
  "tickers": [],
  "type": "article",
  "snippet": "Summary: Once (very briefly) valued at $2 billion, Taiwan-based Perfect Corp. (NYSE:PERF) is a busted microcap SPAC that trades at a negative EV even though it has sales growth and",
  "folders": [
    "Thesis/Stocks"
  ],
  "tags": [],
  "highlights": [],
  "content_html": ""
}
