{
  "schema_version": 1,
  "id": "b960640dcbc2ec5b4092793354f50a3a62198b710bd39a12eb184a49da031340",
  "status": "saved",
  "title": "https://t.co/rvujDVRZIJ",
  "url": "https://x.com/gregoryblotnick/status/2076585078143029588",
  "source": "X Bookmarks",
  "category": "Bookmarks",
  "date": "2026-07-13T08:30:38.000Z",
  "saved_at": "2026-07-26T17:35:19.968Z",
  "themes": [],
  "tickers": [],
  "type": "bookmark",
  "snippet": "https://t.co/rvujDVRZIJ",
  "folders": [
    "Non-market"
  ],
  "tags": [],
  "highlights": [],
  "content_html": "",
  "content_kind": "article",
  "content_text": "https://t.co/rvujDVRZIJ",
  "content_meta": {
    "platform": "x",
    "tweet_id": "2076585078143029588",
    "thread_length": 1,
    "is_note_tweet": false,
    "enriched_at": "2026-07-26T17:35:19.968Z"
  }
}
