{
  "schema_version": 1,
  "id": "67e979b3eb4851ed34c94fc8ed62da1e05b6025b339c82ef37314dbe2aceb2c6",
  "status": "saved",
  "title": "Serious question, how does one get into hardware. Like what is the CS50 into to programming version of this but for h…",
  "url": "https://x.com/thisis_rahmat/status/2089735337618620517",
  "source": "X Bookmarks",
  "category": "Bookmarks",
  "date": "2026-08-18T15:25:04.000Z",
  "saved_at": "2026-08-20T02:51:34.697Z",
  "themes": [],
  "tickers": [],
  "type": "bookmark",
  "snippet": "Serious question, how does one get into hardware. Like what is the CS50 into to programming version of this but for hardware ? How does one learn to build something like this ?",
  "folders": [
    "Non-market"
  ],
  "tags": [],
  "highlights": [],
  "content_html": "",
  "content_kind": "thread",
  "content_text": "[1/2 @thisis_rahmat] Serious question, how does one get into hardware. Like what is the CS50 into to programming version of this but for hardware ? How does one learn to build something like this ? --- [2/2 @thisis_rahmat] Opened my account because I actually want to get an answer to this, how do you learn to do stuff like this ?",
  "content_meta": {
    "platform": "x",
    "tweet_id": "2089735337618620517",
    "thread_length": 2,
    "is_note_tweet": false,
    "enriched_at": "2026-08-20T02:51:34.697Z"
  }
}
