{
  "schema_version": 1,
  "id": "8f2c8af60c8b59c81e43f0ae036b4975faca98501a6a38a62073fad9d46fa1f7",
  "status": "saved",
  "title": "delayed decisions are rarely the result of uncertainty and more often the result of discomfort of being the person th…",
  "url": "https://x.com/Thzer0r/status/2097014282357784599",
  "source": "X Bookmarks",
  "category": "Bookmarks",
  "date": "2026-09-07T17:29:00.000Z",
  "saved_at": "2026-09-08T05:06:55.544Z",
  "themes": [
    "favs"
  ],
  "tickers": [],
  "type": "bookmark",
  "snippet": "delayed decisions are rarely the result of uncertainty and more often the result of discomfort of being the person that has to pull the trigger.",
  "folders": [
    "Non-market"
  ],
  "tags": [
    "favs"
  ],
  "highlights": [],
  "content_html": "",
  "content_kind": "tweet",
  "content_text": "delayed decisions are rarely the result of uncertainty and more often the result of discomfort of being the person that has to pull the trigger.",
  "content_meta": {
    "platform": "x",
    "tweet_id": "2097014282357784599",
    "thread_length": 1,
    "is_note_tweet": false,
    "enriched_at": "2026-09-08T05:06:55.544Z"
  }
}
