{
  "schema_version": 1,
  "id": "d0ef6d6120e4d693c12f92ee37336adc4fac787105133ae5bcb9321a788d6566",
  "status": "saved",
  "title": "https://t.co/KSrFR8z0cA",
  "url": "https://x.com/gregoryblotnick/status/2001641818216137089",
  "source": "X Bookmarks",
  "category": "Bookmarks",
  "date": "2025-12-18T13:12:52.000Z",
  "saved_at": "2026-07-06T16:17:29.545Z",
  "themes": [],
  "tickers": [],
  "type": "bookmark",
  "snippet": "https://t.co/KSrFR8z0cA",
  "folders": [
    "LS"
  ],
  "tags": [],
  "highlights": [],
  "content_html": "",
  "content_kind": "article",
  "content_text": "https://t.co/KSrFR8z0cA",
  "content_meta": {
    "platform": "x",
    "tweet_id": "2001641818216137089",
    "thread_length": 32,
    "is_note_tweet": false,
    "enriched_at": "2026-07-06T16:17:29.545Z"
  }
}
