{
  "schema_version": 1,
  "id": "ea7653acff93a69dce5e67f160c2b3f50cf6d2031868d6fb0379bc68e2688735",
  "status": "saved",
  "title": "Lots of students asking me how to learn more about markets, I tell them here (if they can avoid the crap). This is a …",
  "url": "https://x.com/macro_punting/status/2091615002662736049",
  "source": "X Bookmarks",
  "category": "Bookmarks",
  "date": "2026-08-23T19:54:11.000Z",
  "saved_at": "2026-08-30T22:32:02.201Z",
  "themes": [],
  "tickers": [],
  "type": "bookmark",
  "snippet": "Lots of students asking me how to learn more about markets, I tell them here (if they can avoid the crap). This is a great example of the great analysis that can be found here @JeremyWS https://t.…",
  "folders": [
    "Markets"
  ],
  "tags": [],
  "highlights": [],
  "content_html": "",
  "content_kind": "tweet",
  "content_text": "Lots of students asking me how to learn more about markets, I tell them here (if they can avoid the crap). This is a great example of the great analysis that can be found here @JeremyWS https://jwsmacro.substack.com/p/8-playing-devils-advocate",
  "content_meta": {
    "platform": "x",
    "tweet_id": "2091615002662736049",
    "thread_length": 1,
    "is_note_tweet": false,
    "enriched_at": "2026-08-30T22:32:02.201Z"
  }
}
