{
  "schema_version": 1,
  "id": "8343bd64d0d3879d70f4fc82237b6594ebf72a65c6613eaefaaf41a21b901936",
  "status": "saved",
  "title": "bunch of frameworks + model portfolio template ideas in here -- different ways to think about L/S, both top-down and …",
  "url": "https://x.com/gregoryblotnick/status/2070207236299776191",
  "source": "X Bookmarks",
  "category": "Bookmarks",
  "date": "2026-06-25T18:07:22.000Z",
  "saved_at": "2026-07-06T17:18:59.047Z",
  "themes": [],
  "tickers": [],
  "type": "bookmark",
  "snippet": "bunch of frameworks + model portfolio template ideas in here -- different ways to think about L/S, both top-down and bottom-up, different ways to sort and force-rank a universe of long and short id…",
  "folders": [
    "LS"
  ],
  "tags": [],
  "highlights": [],
  "content_html": "",
  "content_kind": "note",
  "content_text": "bunch of frameworks + model portfolio template ideas in here -- different ways to think about L/S, both top-down and bottom-up, different ways to sort and force-rank a universe of long and short ideas -- probability weightings, risk/reward weightings, ways to think about upside vs. downside, ways to think about ranges of outcomes, ways to bucket variables no right or wrong. just the various schools of thought to choose from -- ways to think about exposure as an output instead of an input, dynamic adjustments driven by the mkt and by valuations, where you focus on bottoms-up ideas and let them dictate the top-down -- all from several angles, mostly an individual or a single-mgr. the multi-mgr factor-neutral model is sort of its own universe...one which is overly complex, difficult to duplicate, and has a time horizon measured in days imo, only a fool would say \"I'm going to pick a fight with the toughest competition, I'm going to do it on their turf, and I'm going to do it on their terms\" so idk what benefit there is in writing about it or about factors in general...capital duration is a real source of edge, these short-term drivers of price should prob be avoided rather than embraced there's a lot in here, but it will 100% help u think differently... that is all I promise, and nothing more 🎁",
  "content_meta": {
    "platform": "x",
    "tweet_id": "2070207236299776191",
    "thread_length": 1,
    "is_note_tweet": true,
    "enriched_at": "2026-07-06T17:18:59.047Z"
  }
}
