{
  "schema_version": 1,
  "id": "42bcf4d15868787aeda2c4787bb70698e2c178751134124b391c8c2a4ac081d7",
  "status": "saved",
  "title": "The question of whether AI will generate alpha in the investment process to me is rather obvious. AI can help us: 1…",
  "url": "https://x.com/FundamentEdge/status/2039739713360408779",
  "source": "X Bookmarks",
  "category": "Bookmarks",
  "date": "2026-04-02T16:20:18.000Z",
  "saved_at": "2026-07-06T16:17:15.835Z",
  "themes": [],
  "tickers": [],
  "type": "bookmark",
  "snippet": "The question of whether AI will generate alpha in the investment process to me is rather obvious. AI can help us: 1) know companies better 2) track them more closely 3) make better decisions Use…",
  "folders": [
    "Ai for Investing"
  ],
  "tags": [],
  "highlights": [],
  "content_html": "",
  "content_kind": "thread",
  "content_text": "[1/11 @FundamentEdge] The question of whether AI will generate alpha in the investment process to me is rather obvious. AI can help us: 1) know companies better 2) track them more closely 3) make better decisions Used effectively, agentic AI is clearly a powerful tool for alpha generation. But it's the system around AI that matters. AI doesn't know the answers to my questions, but can enable a process around building much more comprehensive insight in the same block of time. Don't outsource, augment. Like any tool, however, how you use the tool is what matters. I'll give an example. I like to time-block parts of the investment process in my pedagogical approach. How investors spend their time is a critical decision when we all are working with the same ~3,000 hours in a year. I could map out a 300 hour due diligence process on a name, but then I only get 10 shots on goal in a year. If you've been in the seat of a public investor, you know this is a never ending game of triage, particularly as coverage broadens & idea velocity demands increase. When thinking about time blocking your investment process with AI, I would encourage you to do a \"before & after\" approach. I hear from investors often \"I did the AI augmented approach, but I don't feel like I know the name as well\". I sympathize with that, and agree, but when I push back the obvious point is that they tried to compress 60 hours down to 20 hours. There certainly will be comprehension lost in translation trying to do that. My suggestion is to time block that entire 60 hours. You are saving ~40 hours, how will you redeploy that 40 hours? Your portfolio won't magically include 3x the number of ideas, so how do you increase the research quality of the existing idea flow? This is where I think top decile investment process will radically change in the next 9-18 months. AI will raise the floor in investment process quality, democratizing \"institutional like\" quality, but raising the ceiling is what matters: alpha is an adaptive game where power law prevails. Running the same desktop research game with small snippets of primary research won't continue to work, in my opinion. Raising the ceiling, to me, is not about working fewer hours, it's about driving much more comprehensive understanding of the business & the stock in that same 60 hours. Some of this is \"what's old is new again\" (i.e. for example, multi-manager investment professionals are less present at trade shows than Tiger investors, for example, due to burden of desktop research demands in coverage model). But some of it is thoughtfully deploying brand new AI-augmented processes that can drive deeper comprehension, closer KPI tracking and help drive better, less emotional decision making. To simplify, a compression of desktop research opens up meaningful capacity for more primary research. The critical question then becomes , even if the compression of 60 to 20 leads to some degradation of name comprehension, is that degradation more than offset by the brand new 40 hours of AI augmented primary research. My belief is yes. --- [2/11 @jamesthomason] @FundamentEdge This is such a good take. The models get you ramped to consensus and key drivers in record time. Your alpha is outside the building. The models free you to do the work that actually results in a differentiated view. --- [3/11 @hedgie007] @FundamentEdge If everyone has access, and AI has democratized the process and tool availability, couldn’t you argue the opportunity for alpha generation has been made harder? --- [4/11 @S_Kadakia] @FundamentEdge Agree on the redeployment into primary. Worth underlining how primary research itself is changing. AI can structure and scale expert convos in ways that weren't possible 2 years ago. --- [5/11 @argosyinvestors] @FundamentEdge Only 3,000 hours?! https://t.co/yalXCFtAiw --- [6/11 @ChauHymn48817] @FundamentEdge For someone starting off their career would you say it'd be better to do it without the AI for the first year and then slowly layer in AI-augmentation to save time for primary research? Or would the competitive disadvantage compared to fellow interns be too great --- [7/11 @FundamentEdge] It's such a great question. I think a lot of it depends on the type of seat you're in and the culture and expectations of your managing PM. I bias towards learning the artisanal way in the first 9-18 months with selective AI augmentation mostly around developing more things to read. But I could also make the case for deeper augmentation faster. There are really two sides and very strong views on both --- [8/11 @ThetaCatalyst] @FundamentEdge Well said. Loved the most recent YouTube vid --- [9/11 @jackzumwalt] @FundamentEdge This is actually super helpful to gauge our focus at Kimpton. Up for a call? I think we would get a lot out of your perspective. --- [10/11 @FundamentEdge] @jackzumwalt Yeah happy to chat - DM me --- [11/11 @kwasijouer] @FundamentEdge After the last 5 days I’ve spent being able to utilize Computer to create an exoskeleton system and watching the iterative responses and connections it was outputting in response. I fully agree with this!",
  "content_meta": {
    "platform": "x",
    "tweet_id": "2039739713360408779",
    "thread_length": 11,
    "is_note_tweet": true,
    "enriched_at": "2026-07-06T16:17:15.835Z"
  }
}
